"created_at","action_name","path_name"
'2022-11-06 00:14:53.340',"Conduct research and analysis of legal problems","lawyers"
'2022-11-06 00:14:53.340',"Interpret laws and rulings and regulations for individuals and businesses","lawyers"
'2022-11-06 00:14:53.340',"Present facts in writing and verbally to their clients or others","lawyers"
'2022-11-06 00:14:53.340',"argue on behalf of their clients","lawyers"
'2022-11-06 00:14:53.340',"Prepare and file legal documents such as lawsuits  appeals wills contracts and deeds","lawyers"
'2022-11-06 00:16:49.031',"build and maintain test facilities for aircraft systems","aerospace engineering and operations technicians"
'2022-11-06 00:16:49.031',"make and install parts and systems to be tested in test equipment","aerospace engineering and operations technicians"
'2022-11-06 00:16:49.031',"operate and calibrate computer systems so that they comply with test and manufacturing requirements","aerospace engineering and operations technicians"
'2022-11-06 00:16:49.031',"record data from test parts and assemblies","aerospace engineering and operations technicians"
'2022-11-06 00:16:49.031',"direct and coordinate the design manufacture and testing of aircraft and aerospace products","aerospace engineers"
'2022-11-06 00:16:49.031',"assess proposals for projects to determine if they are technically and financially feasible","aerospace engineers"
'2022-11-06 00:16:49.031',"determine if proposed projects will result in safe operations that meet the defined goals","aerospace engineers"
'2022-11-06 00:16:49.031',"use computer software to design equipment systems or structures","agricultural engineers"
'2022-11-06 00:16:49.031',"modify environmental factors that affect animal or crop production","agricultural engineers"
'2022-11-06 00:16:49.031',"test equipment to ensure is safety and reliability","agricultural engineers"
'2022-11-06 00:16:49.031',"meet with clients to determine objectives and requirements for structures","architects"
'2022-11-06 00:16:49.031',"give preliminary estimates on cost and construction time","architects"
'2022-11-06 00:16:49.031',"prepare structure specifications","architects"
'2022-11-06 00:16:49.031',"design biomedical equipment and devices","biomedical engineers"
'2022-11-06 00:16:49.031',"install adjust maintain repair or provide technical support for biomedical equipment","biomedical engineers"
'2022-11-06 00:16:49.031',"evaluate the safety efficiency and effectiveness of biomedical equipment","biomedical engineers"
'2022-11-06 00:16:49.031',"collect geographic data","cartographers photogrammetrists"
'2022-11-06 00:16:49.031',"create visual representations of data","cartographers photogrammetrists"
'2022-11-06 00:16:49.031',"examine and compile data from ground surveys reports aerial photographs and satellite images","cartographers photogrammetrists"
'2022-11-06 00:16:49.031',"conduct research to develop new and improved manufacturing processes","chemical engineers"
'2022-11-06 00:16:49.031',"establish safety procedures for those working with dangerous chemicals","chemical engineers"
'2022-11-06 00:16:49.031',"develop processes for separating components of liquids and gases","chemical engineers"
'2022-11-06 00:16:49.031',"read and review project drawings and plans to determine the size of structures","civil engineering technicians"
'2022-11-06 00:16:49.031',"confer with engineers about preparing plans","civil engineering technicians"
'2022-11-06 00:16:49.031',"use computer aided design software under the charge of engineers","civil engineering technicians"
'2022-11-06 00:16:49.031',"analyze long range plans survey reports maps and other data to plan and design projects","civil engineers"
'2022-11-06 00:16:49.031',"consider construction costs government regulations","civil engineers"
'2022-11-06 00:16:49.031',"potential environmental hazards and other factors during the planning and risk analysis stages of a project","civil engineers"
'2022-11-06 00:16:49.031',"design new computer hardware creating schematics of computer equipment to be built","computer hardware engineers"
'2022-11-06 00:16:49.031',"test the computer hardware they design","computer hardware engineers"
'2022-11-06 00:16:49.031',"analyze the test results and modify the design as needed","computer hardware engineers"
'2022-11-06 00:16:49.031',"design plans using computer aided design software","drafters"
'2022-11-06 00:16:49.031',"work from rough sketches and specifications created by engineers and architects","drafters"
'2022-11-06 00:16:49.031',"design products with engineering and manufacturing techniques","drafters"
'2022-11-06 00:16:49.031',"put together electrical and electronic systems and prototypes","electrical and eletronics engineering technicians"
'2022-11-06 00:16:49.031',"build calibrate and repair electrical instruments or testing equipment","electrical and eletronics engineering technicians"
'2022-11-06 00:16:49.031',"visit construction sites to observe conditions affecting design","electrical and eletronics engineering technicians"
'2022-11-06 00:16:49.031',"design new ways to use electrical power to develop or improve products","electrical land electronics engineers"
'2022-11-06 00:16:49.031',"perform detailed calculations to develop manufacturing construction and installation standards and specifications","electrical land electronics engineers"
'2022-11-06 00:16:49.031',"design electronic components and software products or systems for commercial industrial medical military or scientific applications","electrical land electronics engineers"
'2022-11-06 00:16:49.031',"read blueprints and schematics and diagrams to determine the method and sequence of assembly of part machine or piece of equipment","electro mechanical technicians"
'2022-11-06 00:16:49.031',"inspect parts for surface defects","electro mechanical technicians"
'2022-11-06 00:16:49.031',"operate test or maintain robotic equipment","electro mechanical technicians"
'2022-11-06 00:16:49.031',"set up test operate and modify equipment used to prevent or clean up environmental pollution","environmental engineering technicians"
'2022-11-06 00:16:49.031',"maintain project records and computer program files","environmental engineering technicians"
'2022-11-06 00:16:49.031',"conduct pollution surveys for which they collect and analyze samples such as samples of air and ground quality","environmental engineering technicians"
'2022-11-06 00:16:49.031',"prepare review and u[date environmental investigation","environmental engineers"
'2022-11-06 00:16:49.031',"design projects that lead to environmental protection such was water reclamation facilities or air pollution control systems","environmental engineers"
'2022-11-06 00:16:49.031',"maintain and apply knowledge of current health and safety policies regulations and industrial processes","health and safety engineers"
'2022-11-06 00:16:49.031',"review plans and specifications for new machinery and equipment to make sure that they meet safety requirements","health and safety engineers"
'2022-11-06 00:16:49.031',"suggest revisions to methods of operation material handling or equipment layout","industrial engineering technicians"
'2022-11-06 00:16:49.031',"interpret engineering drawings and schematic diagrams and formulas","industrial engineering technicians"
'2022-11-06 00:16:49.031',"confer with management or engineering staff to determine quality and reliability standards","industrial engineering technicians"
'2022-11-06 00:16:49.031',"industrial engineers find ways to eliminate wastefulness in production processes","industrial engineers"
'2022-11-06 00:16:49.031',"landscape architects design parts and the outdoor spaces of campuses recreational facilities businesses private homes and other open spaces","landscape architects"
'2022-11-06 00:16:49.031',"marine engineers and naval architects design build and maintain ships","marine engineers and naval architects"
'2022-11-06 00:16:49.031',"plan and evaluate new proejcts consulting with other engineers and managers as necessary","materials engineers"
'2022-11-06 00:16:49.031',"prepare proposals and budgets analyze labor costs write reports and perform other managerial tasks","materials engineers"
'2022-11-06 00:16:49.031',"evaluate design drawings for new or changed tools by measuring dimensions on the drawings and comparing them with the original specifications","mechanical engineering technicians"
'2022-11-06 00:16:49.031',"prepare layouts and drawings of parts to be made and of the process for putting the parts together","mechanical engineering technicians"
'2022-11-06 00:16:49.031',"analyze problems to see how mechanical and thermal devices might help solve a particular problem","mechanical engineers"
'2022-11-06 00:16:49.031',"design or redesign mechanical and thermal devices or subsystems using analysis and computer aided design","mechanical engineers"
'2022-11-06 00:16:49.031',"investigate equipment failures or difficulties to diagnose faulty operation and to recommend remedies","mechanical engineers"
'2022-11-06 00:16:49.031',"mining and geological engineers design mines to safely and efficiently remove minerals such as coal and metals for use in manufacturing and utilities","mining and geological engineers"
'2022-11-06 00:16:49.031',"design or develop nuclear equipment such as reactor cores radiation shielding and associated instrumentation","nuclear engineers"
'2022-11-06 00:16:49.031',"direct operating or maintenance activities of operational nuclear power plans to ensure that they meet safety standards","nuclear engineers"
'2022-11-06 00:16:49.031',"design equipment to extract oil and gas from onshore and offshore reserves deep underground","petroleum engineers"
'2022-11-06 00:16:49.031',"develop plans to drill in oil and gas fields and then to recover the oil and gas","petroleum engineers"
'2022-11-06 00:16:49.031',"develop ways to inject water chemicals gases or steam into an oil reserve to force out more oil or gas","petroleum engineers"
'2022-11-06 00:16:49.031',"surveying and mapping technicians collect data and make maps of the earths surface","surveying and mapping technicians"
'2022-11-06 00:16:49.031',"surveying technicians visit sites to take measurements of the land","surveying and mapping technicians"
'2022-11-06 00:16:49.031',"mapping technicians use geographic data to create maps","surveying and mapping technicians"
'2022-11-06 00:16:49.031',"surveys make precise measurements to determine property boundaries","surveyors"
'2022-11-06 00:16:49.031',"they provide data relevant to the shape and contour of the earths surface for engineering map making and construction projects","surveyors"
'2022-11-06 00:16:49.031',"determine how best to represent a concept visually","art directors"
'2022-11-06 00:16:49.031',"determine which photographs art or other design elements to use","art directors"
'2022-11-06 00:16:49.031',"develop the overall look or style of a publication an advertising campaign or a theater television or film set","art directors"
'2022-11-06 00:16:49.031',"use techniques such as knitting weaving glassblowing painting drawing and sculpting","craft and fine artists"
'2022-11-06 00:16:49.031',"develop creative ideas or new methods for making art","craft and fine artists"
'2022-11-06 00:16:49.031',"create sketches templates or models to guide their work","craft and fine artists"
'2022-11-06 00:16:49.031',"study fashion trends and anticipate designs that will appeal to consumers","fashion designers"
'2022-11-06 00:16:49.031',"decide on a theme for a collection","fashion designers"
'2022-11-06 00:16:49.031',"use computer aided design programs to create designs","fashion designers"
'2022-11-06 00:16:49.031',"purchase flowers from wholesalers and suppliers to ensure an adequate supply to meet customers needs","floral designers"
'2022-11-06 00:16:49.031',"determine the type of arrangement desired the occasion and the date time and location for delivery","floral designers"
'2022-11-06 00:16:49.031',"meet with clients or the art director to determine the scope of a project","graphic designers"
'2022-11-06 00:16:49.031',"use digital illustration photo editing software and layout software to create designs","graphic designers"
'2022-11-06 00:16:49.031',"create visual elements such as logos original images and illustrations that help deliver a desired message","graphic designers"
'2022-11-06 00:16:49.031',"consult with clients to determine requirements for designs","industrial designers"
'2022-11-06 00:16:49.031',"research the various ways a particular product might be used and who will use it","industrial designers"
'2022-11-06 00:16:49.031',"sketch out ideas or create renderings","industrial designers"
'2022-11-06 00:16:49.031',"search for and bid on new projects","interior designers"
'2022-11-06 00:16:49.031',"determine the clients goals and requirements for the project","interior designers"
'2022-11-06 00:16:49.031',"consider how the space will be used and how people will move through the space","interior designers"
'2022-11-06 00:16:49.031',"use computer programs and illustrations to create graphics and animation","multimedia artists and animators"
'2022-11-06 00:16:49.031',"work with a team of animators and artists to create a movie game or visual effect","multimedia artists and animators"
'2022-11-06 00:16:49.031',"research upcoming projects to help create realistic designs or animations","multimedia artists and animators"
'2022-11-06 00:16:49.031',"mow edge and fertilize lawns","grounds maintenance workers"
'2022-11-06 00:16:49.031',"weed and mulch landscape beds","grounds maintenance workers"
'2022-11-06 00:16:49.031',"trim hedges and shrubs and small trees","grounds maintenance workers"
'2022-11-06 00:16:49.031',"gather and empty trash","janitors and building cleaners"
'2022-11-06 00:16:49.031',"sweep mop or vacuum building floors","janitors and building cleaners"
'2022-11-06 00:16:49.031',"clean restrooms and stock them with supplies","janitors and building cleaners"
'2022-11-06 00:16:49.031',"inspect buildings and premises for signs of pests or infestation","pest control workers"
'2022-11-06 00:16:49.031',"determine the type of treatment needed to eliminate pests","pest control workers"
'2022-11-06 00:16:49.031',"measure the dimensions of the area needing treatment","pest control workers"
'2022-11-06 00:16:49.031',"examine financial statements to ensure that they are accurate and comply with laws and regulations","accountants and auditors"
'2022-11-06 00:16:49.031',"compute taxes owed","accountants and auditors"
'2022-11-06 00:16:49.031',"verify legal descriptions of real estate properties in public records","appraisers and assessors of real estate"
'2022-11-06 00:16:49.031',"inspect new and existing properties noting the characteristics","appraisers and assessors of real estate"
'2022-11-06 00:16:49.031',"work with program and project managers to develop the organizations budget","budget analysts"
'2022-11-06 00:16:49.031',"review managers budget proposals for completeness accuracy and compliance with laws and other regulations","budget analysts"
'2022-11-06 00:16:49.031',"investigate evaluate and settle insurance claims","claims adjusters appraisers examiners and investigators"
'2022-11-06 00:16:49.031',"determine whether the insurance policy covers the loss claimed","claims adjusters appraisers examiners and investigators"
'2022-11-06 00:16:49.031',"decide the appropriate amount the insurance company should pay","claims adjusters appraisers examiners and investigators"
'2022-11-06 00:16:49.031',"research compensation and benefits policies and plans","compensation benefits and job analysis specialists"
'2022-11-06 00:16:49.031',"use data and cost analyses to compare compensation and benefits plans","compensation benefits and job analysis specialists"
'2022-11-06 00:16:49.031',"evaluate position descriptions to determine classification and salary","compensation benefits and job analysis specialists"
'2022-11-06 00:16:49.031',"identify factors affecting costs and such as production time materials and labor","cost estimators"
'2022-11-06 00:16:49.031',"read blueprints and technical documents in order to prepare estimates","cost estimators"
'2022-11-06 00:16:49.031',"collaborate with engineers architects clients and contractors","cost estimators"
'2022-11-06 00:16:49.031',"recommend individual investments and collections of investments which are known as portfolios","financial analysts"
'2022-11-06 00:16:49.031',"evaluate current and historical financial data","financial analysts"
'2022-11-06 00:16:49.031',"study economic and business trends","financial analysts"
'2022-11-06 00:16:49.031',"monitor the financial condition of banks and other financial institutions","financial examiners"
'2022-11-06 00:16:49.031',"review balance sheets operating income and expense accounts and loan documentation to confirm institution assets and liabilities","financial examiners"
'2022-11-06 00:16:49.031',"research propsective donors","fundraisers"
'2022-11-06 00:16:49.031',"create a strong fundraising message that appeals to poitential donors","fundraisers"
'2022-11-06 00:16:49.031',"identify and contact potential donors","fundraisers"
'2022-11-06 00:16:49.031',"use online platforms to raise donations","fundraisers"
'2022-11-06 00:16:49.031',"consult with employers to identify employment needs","human resources specialists"
'2022-11-06 00:16:49.031',"interview applicants about their experience education and skills","human resources specialists"
'2022-11-06 00:16:49.031',"contact references and perform background checks on job applicants","human resources specialists"
'2022-11-06 00:16:49.031',"analyze information stated on insurance applications","insurance underwriters"
'2022-11-06 00:16:49.031',"determine the risk involved in insuring a client","insurance underwriters"
'2022-11-06 00:16:49.031',"screen applicants on the basis of set criteria","insurance underwriters"
'2022-11-06 00:16:49.031',"evaluate recommendations from underwriting software","insurance underwriters"
'2022-11-06 00:16:49.031',"advise management n contracts worker grievances and disciplinary procedures","labor relations specialists"
'2022-11-06 00:16:49.031',"lead meetings between management and labor","labor relations specialists"
'2022-11-06 00:16:49.031',"m eet with union representatitves","labor relations specialists"
'2022-11-06 00:16:49.031',"contact companies or people to ask if they need a loan","loan officers"
'2022-11-06 00:16:49.031',"meet with loan applicants to gather personal information and answer questions","loan officers"
'2022-11-06 00:16:49.031',"explain different types of loans and the terms of each type to applicants","loan officers"
'2022-11-06 00:16:49.031',"obtain verify and analyze the applicants financial information such as credit rating and income level","loan officers"
'2022-11-06 00:16:49.031',"manage a products life cycle from design to disposal","logisticians"
'2022-11-06 00:16:49.031',"direct the allocation of materials and suppliers and clients","logisticians"
'2022-11-06 00:16:49.031',"develop business relationships with suppliers and clients","logisticians"
'2022-11-06 00:16:49.031',"gather and organize information about the problem to be solved or the procedure to be improved","management analysts"
'2022-11-06 00:16:49.031',"interview personnel and conduct onsite observations to determine the methods equipment and personnel that will be needed","management analysts"
'2022-11-06 00:16:49.031',"analyze financial and other data including revenue expenditure and employment reports","management analysts"
'2022-11-06 00:16:49.031',"monitor and forecast marketing and sales trends","market research analysts"
'2022-11-06 00:16:49.031',"measure the effectiveness of marketing programs and strategies","market research analysts"
'2022-11-06 00:16:49.031',"devise and evaluate methods for collecting data such as surveys questionnaires and opinion polls","market research analysts"
'2022-11-06 00:16:49.031',"meet with clients to understand the purpose of the meeting or event","meeting convention and event planner"
'2022-11-06 00:16:49.031',"plan the scope of the event including its time location and cost","meeting convention and event planner"
'2022-11-06 00:16:49.031',"solicit bids from venues and service providers","meeting convention and event planner"
'2022-11-06 00:16:49.031',"meet with clients in person to discuss their financial goals","personal financial advisors"
'2022-11-06 00:16:49.031',"explain the types of financial services they provide to potential clients","personal financial advisors"
'2022-11-06 00:16:49.031',"educate clients and answer questions about investment options and potential risks","personal financial advisors"
'2022-11-06 00:16:49.031',"evaluate suppliers on the bass of the price quality and speed of delivery of their products and services","purchasing managers buyers and purchasing agents"
'2022-11-06 00:16:49.031',"interview vendors and visit suppliers plants and distribution centers to examine and learn about products and services and prices","purchasing managers buyers and purchasing agents"
'2022-11-06 00:16:49.031',"test and evaluate existing network systems","computer support specialists"
'2022-11-06 00:16:49.031',"perform regular maintenance to ensure that networks operate correctly","computer support specialists"
'2022-11-06 00:16:49.031',"troubleshoot local area networks wide area networks and internet systems","computer support specialists"
'2022-11-06 00:16:49.031',"review filed tax returns to determine whether credits and deductions claimed are allowed by law","tax examiners and collectors and revenue agents"
'2022-11-06 00:16:49.031',"contact taxpayers to address problems and to request supporting documentation","tax examiners and collectors and revenue agents"
'2022-11-06 00:16:49.031',"conduct field audits and investigations of income tax returns to verify information or to update tax liabilities","tax examiners and collectors and revenue agents"
'2022-11-06 00:16:49.031',"assess training needs through surveys interviews with employees or consultations with managers or instructors","training and development specialists"
'2022-11-06 00:16:49.031',"design and create training manuals online learning modules and course materials","training and development specialists"
'2022-11-06 00:16:49.031',"assess the health needs of the people and communities they serve","health educators and community health workers"
'2022-11-06 00:16:49.031',"develop programs materials and events to teach people about health topics","health educators and community health workers"
'2022-11-06 00:16:49.031',"teach people how to manage existing health conditions","health educators and community health workers"
'2022-11-06 00:16:49.031',"encourage clients to discuss their emotions and experiences","marriage and family therapists"
'2022-11-06 00:16:49.031',"help clients process their reacts and adjust to difficult changes in their life such as divorce and layoffs","marriage and family therapists"
'2022-11-06 00:16:49.031',"guide clients through the process of making decisions about their future","marriage and family therapists"
'2022-11-06 00:16:49.031',"interview with probationers and parolees their friends and relatives in an office or at a residence to assess progress","probation officers and correctional treatment specialists"
'2022-11-06 00:16:49.031',"evaluate probationers and parolees to determine the best course of action","probation officers and correctional treatment specialists"
'2022-11-06 00:16:49.031',"provide individual and group counseling to help clients adjust to their disability","rehabilitation counselors"
'2022-11-06 00:16:49.031',"evaluate clients abilities interests experiences and skills health and education","rehabilitation counselors"
'2022-11-06 00:16:49.031',"evaluate students abilities and interests through aptitude assessments interviews and individual planning","school and career counselors"
'2022-11-06 00:16:49.031',"identify issues that affect school performance such as poor classroom attendance rates","school and career counselors"
'2022-11-06 00:16:49.031',"help students understand and overcome social or behavioral problems through classroom guidance lessons and counseling","school and career counselors"
'2022-11-06 00:16:49.031',"meet with clients or management to discuss the needs and design of a website","web developers"
'2022-11-06 00:16:49.031',"create and test applications for a website","web developers"
'2022-11-06 00:16:49.031',"write code for the website using programming languages","web developers"
'2022-11-06 00:16:49.031',"help determine what type of aid their clients need","social and human service assistants"
'2022-11-06 00:16:49.031',"work with clients and other professionals such as social workers to develop a treatment plan","social and human service assistants"
'2022-11-06 00:16:49.031',"help clients find assistance with daily activities such as eating and bathing","social and human service assistants"
'2022-11-06 00:16:49.031',"identify people and communities in need of help","social workers"
'2022-11-06 00:16:49.031',"assess clients needs and situations and strengths and support networks to determine their goals","social workers"
'2022-11-06 00:16:49.031',"help clients adjust to changes and challenges in their lives and such as illness divorce or unemployment","social workers"
'2022-11-06 00:16:49.031',"evaluate clients mental and physical health addiction or problematic behavior and assess their readiness for treatment","substance abuse behavioral disorder and mental health counselors"
'2022-11-06 00:16:49.031',"develop recommend and review treatment goals and plans with clients","substance abuse behavioral disorder and mental health counselors"
