"created_at","action_name","path_name"
'2022-11-06 00:16:49.031',"design research projects to test theories about social issues","sociologists"
'2022-11-06 00:16:49.031',"collect data through surveys observations interviews and other sources analyze and draw conclusions from data","sociologists"
'2022-11-06 00:16:49.031',"prepare reports articles or presentations detailing their research findings","sociologists"
'2022-11-06 00:16:49.031',"conduct background research on survey topics","survey researchers"
'2022-11-06 00:16:49.031',"plan and design surveys determine appropriate survey methods","survey researchers"
'2022-11-06 00:16:49.031',"test surveys to make sure that people will understand the questions being asked","survey researchers"
'2022-11-06 00:16:49.031',"coordinate the work of survey interviewers and data collectors","survey researchers"
'2022-11-06 00:16:49.031',"account for and solve problems caused by nonresponse or other sampling issues","survey researchers"
'2022-11-06 00:16:49.031',"analyze data using statistical software and techniques","survey researchers"
'2022-11-06 00:16:49.031',"develop and conduct experimental studies with animals in controlled or natural surroundings","zoologists wildlife biologists"
'2022-11-06 00:16:49.031',"collect biological data and specimens for analysis","zoologists wildlife biologists"
'2022-11-06 00:16:49.031',"study the characteristics of animals and such as their interactions with other species reproduction population dynamics diseases and movements patterns","zoologists wildlife biologists"
'2022-11-06 00:16:49.031',"analyze the influence that human activity has on wildlife and their natural habitats","zoologists wildlife biologists"
'2022-11-06 00:16:49.031',"supervise clerical and administrative personnel","administrative services managers"
'2022-11-06 00:16:49.031',"set goals and deadlines for their department","administrative services managers"
'2022-11-06 00:16:49.031',"develop manage and monitor records","administrative services managers"
'2022-11-06 00:16:49.031',"recommend changes to policies or procedures in order to improve operations","administrative services managers"
'2022-11-06 00:16:49.031',"monitor the facility to ensure that it remains safe secure and well maintained","administrative services managers"
'2022-11-06 00:16:49.031',"work with department heads or staff to discuss topics such as budgets and contracts marketing plans and the selection of advertising media","advertising managers promotions managers marketing managers"
'2022-11-06 00:16:49.031',"plan promotional campaigns such as contents coupons or giveaways","advertising managers promotions managers marketing managers"
'2022-11-06 00:16:49.031',"plan advertising campaigns including which media to advertise in such as radio television print online media and billboards","advertising managers promotions managers marketing managers"
'2022-11-06 00:16:49.031',"negotiate advertising contracts","advertising managers promotions managers marketing managers"
'2022-11-06 00:16:49.031',"make detailed plans for development of new products and designs","architectural managers engineering managers"
'2022-11-06 00:16:49.031',"determine staff training and equipment needs","architectural managers engineering managers"
'2022-11-06 00:16:49.031',"propose budgets for projects and programs","architectural managers engineering managers"
'2022-11-06 00:16:49.031',"hire and supervise staff","architectural managers engineering managers"
'2022-11-06 00:16:49.031',"led research and development projects to produce new products processes or designs","architectural managers engineering managers"
'2022-11-06 00:16:49.031',"analyze their organizations computer needs and recommend possible upgrades for top executives to consider","computer and information systems managers"
'2022-11-06 00:16:49.031',"plan and direct the installation and maintenance of computer hardware and software","computer and information systems managers"
'2022-11-06 00:16:49.031',"ensure the security of an organizations network and electronic documents","computer and information systems managers"
'2022-11-06 00:16:49.031',"prepare cost estimates budgets and work timetables","construction managers"
'2022-11-06 00:16:49.031',"interpret and explain contracts and technical information to other professionals","construction managers"
'2022-11-06 00:16:49.031',"report work progress and budget matters to clients","construction managers"
'2022-11-06 00:16:49.031',"collaborate with architects engineers and other construction specialists","construction managers"
'2022-11-06 00:16:49.031',"manage school activities and staff","elementary middle and high school principals"
'2022-11-06 00:16:49.031',"establish and oversee class schedules","elementary middle and high school principals"
'2022-11-06 00:16:49.031',"develop implement and maintain curriculum standards","elementary middle and high school principals"
'2022-11-06 00:16:49.031',"counsel and discipline students observe teachers and evaluate their performance","elementary middle and high school principals"
'2022-11-06 00:16:49.031',"assess hazards and prepare plns to respond to emergencies and disasters in order to minimize risk to people and property","emergency management directors"
'2022-11-06 00:16:49.031',"meet with public safety officials private companies and the general public to get recommendations regarding emergency response plans","emergency management directors"
'2022-11-06 00:16:49.031',"supervise all steps of the crop production and ranging process including planting fertilizing harvesting and hearding","farmers ranchers and other agricultural managers"
'2022-11-06 00:16:49.031',"determine how to raise crops or livestock by evaluating factors such as market conditions disease soil conditions or a crops growing cycle","farmers ranchers and other agricultural managers"
'2022-11-06 00:16:49.031',"maintain farm facilities and such as water pipes hoses fences and animal shelters","farmers ranchers and other agricultural managers"
'2022-11-06 00:16:49.031',"listen to customers questions and concerns and provide answers or responses","customer service representatives"
'2022-11-06 00:16:49.031',"provide information about products and services","customer service representatives"
'2022-11-06 00:16:49.031',"take orders calculate charges and process billing or payments","customer service representatives"
'2022-11-06 00:16:49.031',"review or make changes to customer accounts","customer service representatives"
'2022-11-06 00:16:49.031',"handle returns or complaints","customer service representatives"
'2022-11-06 00:16:49.031',"prepare financial statements business activity reports and forecasts","financial managers"
'2022-11-06 00:16:49.031',"monitor financial details to ensure that legal requirements are met supervise employees who do financial reporting and budgeting","financial managers"
'2022-11-06 00:16:49.031',"review company financial reports and seek ways to reduce costs","financial managers"
'2022-11-06 00:16:49.031',"analyze market trends to maximize profits and find expansion opportunties","financial managers"
'2022-11-06 00:16:49.031',"hire train oversee and sometimes fire employees","food service managers"
'2022-11-06 00:16:49.031',"order food and beverages equipment and supplies","food service managers"
'2022-11-06 00:16:49.031',"oversee food preparation portion sizes and the overall presentation of food","food service managers"
'2022-11-06 00:16:49.031',"inspect supplies equipment and work areas","food service managers"
'2022-11-06 00:16:49.031',"work with community members and other stakeholders to identify necessary programs and services","social and community service managers"
'2022-11-06 00:16:49.031',"oversee administrative aspects of programs to meet the objectives of the stakeholders","social and community service managers"
'2022-11-06 00:16:49.031',"analyze data to determine the effectiveness of programs","social and community service managers"
'2022-11-06 00:16:49.031',"suggest and implement improvements to programs and services","social and community service managers"
'2022-11-06 00:16:49.031',"plan and coordinate an organizations workforce to best use employees talents","human resources managers"
'2022-11-06 00:16:49.031',"link an organizations management with its employees","human resources managers"
'2022-11-06 00:16:49.031',"plan and oversee employee benefits programs","human resources managers"
'2022-11-06 00:16:49.031',"serve as a consultant with other managers advising them on human resources issues","human resources managers"
'2022-11-06 00:16:49.031',"decide how best to use a plants workers and equipment to meet production goals","industrial production managers"
'2022-11-06 00:16:49.031',"ensure that production stays on schedule and within budget","industrial production managers"
'2022-11-06 00:16:49.031',"hire train and evaluate workers","industrial production managers"
'2022-11-06 00:16:49.031',"analyze production data","industrial production managers"
'2022-11-06 00:16:49.031',"write production reports","industrial production managers"
'2022-11-06 00:16:49.031',"inspect guest rooms public areas and grounds for cleanliness and appearance","lodging managers"
'2022-11-06 00:16:49.031',"ensure that company standards for guest services dcor and housekeeping are met","lodging managers"
'2022-11-06 00:16:49.031',"answer questions from guests about hotel policies and services","lodging managers"
'2022-11-06 00:16:49.031',"keep track of how much money the hotel or lodging facility is making","lodging managers"
'2022-11-06 00:16:49.031',"improve efficiency and quality in delivering healthcare services","medical and health services managers"
'2022-11-06 00:16:49.031',"develop departmental goals and objectives","medical and health services managers"
'2022-11-06 00:16:49.031',"ensure that the facility in which they work is up to date on and compliant with laws and regulations","medical and health services managers"
'2022-11-06 00:16:49.031',"work with top executives to develop goals and strategies for researchers and developers","natural sciences managers"
'2022-11-06 00:16:49.031',"budget resources for projects and programs by determining staffing training and equipment needs","natural sciences managers"
'2022-11-06 00:16:49.031',"hire supervise and evaluate scientists technicians and other staff members","natural sciences managers"
'2022-11-06 00:16:49.031',"determine how many students to admit to the school","postsecondary education administrators"
'2022-11-06 00:16:49.031',"meet with prospective students and encourage them to apply","postsecondary education administrators"
'2022-11-06 00:16:49.031',"review applications to determine if each potential student should be admitted","postsecondary education administrators"
'2022-11-06 00:16:49.031',"analyze data about applicants and admitted students","postsecondary education administrators"
'2022-11-06 00:16:49.031',"supervise preschool teachers and childcare workers","preschool and childcare center directors"
'2022-11-06 00:16:49.031',"hire and train new staff members","preschool and childcare center directors"
'2022-11-06 00:16:49.031',"provide professional development opportunities for staff","preschool and childcare center directors"
'2022-11-06 00:16:49.031',"establish policies and communicate the to staff and parents","preschool and childcare center directors"
'2022-11-06 00:16:49.031',"develop educational programs and standards","preschool and childcare center directors"
'2022-11-06 00:16:49.031',"ensure instructinoal excellence","preschool and childcare center directors"
'2022-11-06 00:16:49.031',"meet with prospective renters and show them properties","property managers real estate managers community association managers"
'2022-11-06 00:16:49.031',"discuss the lead and explain the terms of occupancy or ownership collect monthly fees from tenants or individual owners","property managers real estate managers community association managers"
'2022-11-06 00:16:49.031',"inspect all building facilities including the grounds and equipment","property managers real estate managers community association managers"
'2022-11-06 00:16:49.031',"check the quality of baking ingredients","bakers"
'2022-11-06 00:16:49.031',"prepare equipment for baking","bakers"
'2022-11-06 00:16:49.031',"measure and weigh flour and other ingredients","bakers"
'2022-11-06 00:16:49.031',"combine measured ingredients in mixers or blenders","bakers"
'2022-11-06 00:16:49.031',"knead roll cut and shape dough","bakers"
'2022-11-06 00:16:49.031',"place dough into pans into molds or onto baking sheets","bakers"
'2022-11-06 00:16:49.031',"set oven temperatures and place items into ovens or onto grills","bakers"
'2022-11-06 00:16:49.031',"write press releases and prepare information for the media identify main client groups and audiences and determine the best way to reach them","public relations managers fundraising managers"
'2022-11-06 00:16:49.031',"designate an appropriate spokesperson or information source for media inquiries","public relations managers fundraising managers"
'2022-11-06 00:16:49.031',"help clients communicate effectively with the public","public relations managers fundraising managers"
'2022-11-06 00:16:49.031',"resolve customer complaints regarding sales and service","sales managers"
'2022-11-06 00:16:49.031',"prepare budget and approve expenditures","sales managers"
'2022-11-06 00:16:49.031',"monitor customer preferences to determine the focus of sales efforts","sales managers"
'2022-11-06 00:16:49.031',"analyze sales statistics","sales managers"
'2022-11-06 00:16:49.031',"evaluate clients skin condition and appearance","skincare specialists"
'2022-11-06 00:16:49.031',"discuss available treatments and determine which products will improve clients skin quality","skincare specialists"
'2022-11-06 00:16:49.031',"remove unwanted hair using wax lasers or other approved treatments","skincare specialists"
'2022-11-06 00:16:49.031',"establish and carry out departmental or organizational goals policies and procedures","top executives"
'2022-11-06 00:16:49.031',"direct and oversee an organizations financial and budgetary activities","top executives"
'2022-11-06 00:16:49.031',"manage general activities related to making products and providing services","top executives"
'2022-11-06 00:16:49.031',"consult with other executives and staff and board members about general operations","top executives"
'2022-11-06 00:16:49.031',"compile statistical data and other information for fuher analysis","actuaries"
'2022-11-06 00:16:49.031',"estimate the probability and likely economic cost of an event such as death sickness an accident or a natural disaster","actuaries"
'2022-11-06 00:16:49.031',"design test and administer insurance policies investments pension plans and other business strategies to minimize risk and maximize profitability","actuaries"
'2022-11-06 00:16:49.031',"develop new mathematical rules theories and concepts in areas such as algebra and geometry","mathematicians and statisticians"
'2022-11-06 00:16:49.031',"decide what data are needed to answer specific questions or problems","mathematicians and statisticians"
'2022-11-06 00:16:49.031',"apply mathematical theories and techniques to solve practical problems in business engineering the sciences and other fields","mathematicians and statisticians"
'2022-11-06 00:16:49.031',"design surveys experiments or opinion polls to collect data","mathematicians and statisticians"
'2022-11-06 00:16:49.031',"identify and solve problems in areas such as business logistics healthcare or other fields","operations research analysts"
'2022-11-06 00:16:49.031',"collect and organize information from a variety of sources and such as computer databases and sales histories and customer feedback","operations research analysts"
'2022-11-06 00:16:49.031',"present music news and sports the weather the time and commercials","announcers"
'2022-11-06 00:16:49.031',"interview guests and moderate panels or discussions on their shows","announcers"
'2022-11-06 00:16:49.031',"announce station programming information such as program schedules and station breaks for commercials or public service information","announcers"
'2022-11-06 00:16:49.031',"operate monitor and adjust audio video ligbhting and broadcast equipment to ensure consistent quality","broadcast and sound engineering technicians"
'2022-11-06 00:16:49.031',"setup and take down equipment for events and live performances","broadcast and sound engineering technicians"
'2022-11-06 00:16:49.031',"record speech music and other sounds on recording equipment","broadcast and sound engineering technicians"
'2022-11-06 00:16:49.031',"convert video and audio records to digital formats for editing on computers","broadcast and sound engineering technicians"
'2022-11-06 00:16:49.031',"read content and correct spelling punctuation and grammatical errors","editors"
'2022-11-06 00:16:49.031',"rewrite text to make it easier for readers to understand","editors"
'2022-11-06 00:16:49.031',"verify facts cited in material for publication","editors"
'2022-11-06 00:16:49.031',"evaluate submissions from writers to decide what to publish","editors"
'2022-11-06 00:16:49.031',"answer telephone calls and take messages or forward calls","receptionists"
'2022-11-06 00:16:49.031',"shoot and record television programs motion pictures music videos documentaries or news and sporting events","film and video editors camera operators"
'2022-11-06 00:16:49.031',"organize digital footage with video editing software","film and video editors camera operators"
'2022-11-06 00:16:49.031',"collaborate with a director to determine the overall vision of the production","film and video editors camera operators"
'2022-11-06 00:16:49.031',"discuss filming and editing techniques with a director to improve a scene","film and video editors camera operators"
'2022-11-06 00:16:49.031',"convert concepts in the source language to equivalent concepts in the target language","interpreters translators"
'2022-11-06 00:16:49.031',"compile information and technical terms into glossaries and terminology databases to be used in their oral renditions and translations","interpreters translators"
'2022-11-06 00:16:49.031',"market and advertise services to attract clients","photographers"
'2022-11-06 00:16:49.031',"analyze and plan the composition of photographs","photographers"
'2022-11-06 00:16:49.031',"use various photographic techniques and lighting equipment","photographers"
'2022-11-06 00:16:49.031',"capture subjects in commercial quality photographs","photographers"
'2022-11-06 00:16:49.031',"enhance the subjects appearance with natural or artificial light","photographers"
'2022-11-06 00:16:49.031',"write press releases and prepare information for the media","public relations specialists"
'2022-11-06 00:16:49.031',"respond to information requests from the media","public relations specialists"
'2022-11-06 00:16:49.031',"help clients communicate effectively with the public","public relations specialists"
'2022-11-06 00:16:49.031',"help maintain their organizations corporate image and identity","public relations specialists"
'2022-11-06 00:16:49.031',"research topics and stories that n editor or news director has assigned to them","reporters correspondents and broadcast news analysts"
'2022-11-06 00:16:49.031',"investigate new story ideas and pitch ideas to editors","reporters correspondents and broadcast news analysts"
'2022-11-06 00:16:49.031',"interview people who have information analysis or opinions about a story or article","reporters correspondents and broadcast news analysts"
'2022-11-06 00:16:49.031',"determine the needs of users of technical documentation","technical writers"
'2022-11-06 00:16:49.031',"study product samples and talk with product designers and developers","technical writers"
'2022-11-06 00:16:49.031',"work with technical staff to make products easier to use and thus require fewer instructions","technical writers"
'2022-11-06 00:16:49.031',"write and organize supporting content for products","technical writers"
'2022-11-06 00:16:49.031',"edit standardize or make changes to material prepared by other writers or establishment personnel","technical writers"
'2022-11-06 00:16:49.031',"choose subject matter that interests readers","writers authors"
'2022-11-06 00:16:49.031',"write fiction or nonfiction through scripts novels biographies and more","writers authors"
'2022-11-06 00:16:49.031',"conduct research to obtain factual information and authentic detail","writers authors"
'2022-11-06 00:16:49.031',"write advertising copy for newspapers magazines broadcasts and the internet","writers authors"
'2022-11-06 00:16:49.031',"find consumers and businesses who have overdue bills","bill collectors account collectors"
'2022-11-06 00:16:49.031',"track down consumers who have an out of date address by using the internet post office credit bureaus or neighbors","bill collectors account collectors"
'2022-11-06 00:16:49.031',"inform debtors that they have an overdue bill and try to negotiate a payment","bill collectors account collectors"
'2022-11-06 00:16:49.031',"use bookkeeping software spreadsheets and databases","bookkeeping accounting and auditing clerks"
'2022-11-06 00:16:49.031',"enter financial transactions into the appropriate computer software","bookkeeping accounting and auditing clerks"
'2022-11-06 00:16:49.031',"receive and record cash checks and vouchers","bookkeeping accounting and auditing clerks"
'2022-11-06 00:16:49.031',"put costs and income into the software assigning each to an appropriate account","bookkeeping accounting and auditing clerks"
'2022-11-06 00:16:49.031',"produce reports and such as balance sheets income statements and totals by account","bookkeeping accounting and auditing clerks"
'2022-11-06 00:16:49.031',"review text graphics or other materials created by writers and designers","desktop publishers"
'2022-11-06 00:16:49.031',"edit graphics and such as photographs or illustrations","desktop publishers"
'2022-11-06 00:16:49.031',"import text and graphics into publishing software","desktop publishers"
'2022-11-06 00:16:49.031',"integrate images and text to create cohesive pages","desktop publishers"
'2022-11-06 00:16:49.031',"keep and update financial data","financial clerks"
'2022-11-06 00:16:49.031',"compute bills and charges","financial clerks"
'2022-11-06 00:16:49.031',"offer customer assistance","financial clerks"
'2022-11-06 00:16:49.031',"carry out financial transactions","financial clerks"
'2022-11-06 00:16:49.031',"answer and transfer telephone calls or take messages","general office clerks"
'2022-11-06 00:16:49.031',"sort and deliver incoming mail and send outgoing mail","general office clerks"
'2022-11-06 00:16:49.031',"schedule appointments and receive customers or visitors","general office clerks"
'2022-11-06 00:16:49.031',"provide general information to staff clients or the public","general office clerks"
'2022-11-06 00:16:49.031',"prepare routine reports claims bills or orders","information clerks"
'2022-11-06 00:16:49.031',"collect and record data from customers and staff and the public","information clerks"
'2022-11-06 00:16:49.031',"answer questions from customers and the public about products or services","information clerks"
'2022-11-06 00:16:49.031',"file and maintain paper or electronic records","information clerks"
'2022-11-06 00:16:49.031',"keep records of items shipped received or transferred to another location","material recording clerks"
'2022-11-06 00:16:49.031',"compile reports on various aspects of changes in production or inventory","material recording clerks"
'2022-11-06 00:16:49.031',"find sort or move goods between different parts of the business","material recording clerks"
'2022-11-06 00:16:49.031',"check inventory records for accuracy","material recording clerks"
'2022-11-06 00:16:49.031',"answer emergency telephone and alarm system calls determine the type of emergency and its location and decide the appropriate response on thee basis of agency procedures","police fire and ambulance dispatchers"
'2022-11-06 00:16:49.031',"relay information to the appropriate first responder agency","police fire and ambulance dispatchers"
'2022-11-06 00:16:49.031',"coordinate the dispatch of emergency response personnel to accident scenes","police fire and ambulance dispatchers"
'2022-11-06 00:16:49.031',"collect letters and parcels","postal service workers"
'2022-11-06 00:16:49.031',"sort incoming letters and parcels","postal service workers"
'2022-11-06 00:16:49.031',"sell stamps and other postal products","postal service workers"
'2022-11-06 00:16:49.031',"get customer signatures for registered certified and insured mail","postal service workers"
'2022-11-06 00:16:49.031',"schedule and confirm appointments and maintain calendars","receptionists"
'2022-11-06 00:16:49.031',"greet and welcome customers clients and other visitors","receptionists"
'2022-11-06 00:16:49.031',"check visitors in and direct or escort them to specific destinations","receptionists"
'2022-11-06 00:16:49.031',"answer telephones and take messages or transfer calls","secretaries administrative assistants"
'2022-11-06 00:16:49.031',"schedule appointments and update calendar events","secretaries administrative assistants"
'2022-11-06 00:16:49.031',"arrange staff meetings","secretaries administrative assistants"
'2022-11-06 00:16:49.031',"handle incoming and outgoing mail and faxes","secretaries administrative assistants"
'2022-11-06 00:16:49.031',"prepare memos invoices or other reports","secretaries administrative assistants"
'2022-11-06 00:16:49.031',"edit documents","secretaries administrative assistants"
'2022-11-06 00:16:49.031',"count the cash int heir drawer at the start of their shift","tellers"
